{
  "schema_version": "1.0",
  "enricher_version": "0.2.0",
  "source": {
    "procedure_code": "1.115367",
    "title": "Tổ chức kinh tế nhận chuyển nhượng, thuê quyền sử dụng đất, nhận góp vốn bằng quyền sử dụng đất để thực hiện dự án đầu tư",
    "group_key": "dien_luc_nha_o_dat_dai",
    "workflow_family": null,
    "subflow": null
  },
  "experience": {
    "entry_label": "Hỗ trợ nhà ở, đất đai và điện lực",
    "overview_summary": "Thủ tục này thuộc nhóm đất đai và nhà ở, thường dùng để cấp, đổi hoặc cập nhật giấy chứng nhận và thông tin tài sản gắn liền với đất. Kết quả thường nhận được là Văn bản chấp thuận tổ chức kinh tế được nhận chuyển nhượng, thuê quyền sử dụng đất, nhận góp vốn bằng quyền sử dụng đất để thực hiện dự án đầu tư đối với trường hợp được chấp thuận. Thời gian xử lý tham khảo: 30 ngày làm việc.",
    "next_step_summary": "Nên chuẩn bị trước thông tin thửa đất, tài sản hoặc địa điểm tiếp nhận, rồi chọn kênh nộp phù hợp: Trực tiếp, Trực tuyến, Dịch vụ bưu chính. Hiện có khoảng 2 mục giấy tờ cần theo dõi trong checklist.",
    "tone": "supportive_public_service"
  },
  "guidance": {
    "highlight_documents": [
      {
        "bucket": "required",
        "name": "Mẫu số 11 ban hành kèm theo Quyết định số 104/2026/QĐ-UBND ngày 29/6/2026",
        "conditions": [],
        "attachment_path": "file:///C:/Users/ku060/Downloads/VAIC source/data-pipeline/raw_data/1_115367/Ma%CC%82%CC%83u%20so%CC%82%CC%81%2011.docx"
      },
      {
        "bucket": "required",
        "name": "Trích lục vị trí khu đất mà nhà đầu tư đề xuất thực hiện dự án",
        "conditions": [],
        "attachment_path": null
      }
    ],
    "special_cases": [],
    "common_errors": [
      "Điền sai mẫu tờ khai hoặc chọn sai biểu mẫu đi kèm."
    ],
    "validation_hints": [
      "Nên xác định trước kênh nộp hồ sơ để biết có cần bản giấy, bản điện tử hay xuất trình trực tiếp.",
      "Có mẫu biểu đính kèm, nên kiểm tra đúng biểu mẫu trước khi nộp.",
      "Nên đối chiếu trước thông tin thửa đất, tài sản hoặc hiện trạng hồ sơ để tránh bị yêu cầu chỉnh sửa."
    ]
  },
  "intake": {
    "candidate_input_fields": [
      {
        "field_id": "property_or_service_need",
        "label": "Nhu cầu về đất đai, nhà ở hoặc điện lực",
        "field_type": "text",
        "required": true
      },
      {
        "field_id": "property_location",
        "label": "Địa điểm tài sản hoặc nơi sử dụng dịch vụ",
        "field_type": "text",
        "required": true
      },
      {
        "field_id": "submission_channel_preference",
        "label": "Kênh nộp dự kiến",
        "field_type": "enum",
        "required": false
      },
      {
        "field_id": "has_current_certificate",
        "label": "Đã có giấy tờ/tài liệu hiện trạng",
        "field_type": "boolean",
        "required": false
      },
      {
        "field_id": "land_plot_identifier",
        "label": "Thông tin thửa đất",
        "field_type": "text",
        "required": false
      }
    ],
    "suggested_clarifying_questions": [
      "Bạn đang xử lý nhu cầu nào về đất đai, nhà ở hoặc điện lực?",
      "Bạn đã có thông tin thửa đất, địa chỉ tài sản hoặc giấy tờ hiện trạng chưa?"
    ]
  },
  "ui_hints": {
    "primary_channel": "in_person",
    "result_label": "Văn bản chấp thuận tổ chức kinh tế được nhận chuyển nhượng, thuê quyền sử dụng đất, nhận góp vốn bằng quyền sử dụng đất để thực hiện dự án đầu tư đối với trường hợp được chấp thuận",
    "time_badge": "30 ngày làm việc",
    "document_count_badge": 2
  },
  "provenance": {
    "generator": "workflow_domain_enricher",
    "derivation_mode": "rule_based_semantic_enrichment",
    "supported_group": true
  }
}