{
  "schema_version": "1.0",
  "enricher_version": "0.2.0",
  "source": {
    "procedure_code": "1.115305",
    "title": "Đăng ký lao động đối với người lao động đang có việc làm không thuộc đối tượng tham gia bảo hiểm xã hội bắt buộc, người thất nghiệp.",
    "group_key": "suc_khoe_y_te",
    "workflow_family": null,
    "subflow": null
  },
  "experience": {
    "entry_label": "Hỗ trợ y tế và bảo hiểm",
    "overview_summary": "Thủ tục này thuộc nhóm y tế, thường cần đối chiếu thông tin người bệnh, đơn vị tiếp nhận hoặc quyền lợi chuyên ngành. Kết quả thường nhận được là - Nếu đăng ký không thành công hệ thống phản hồi lý do. Thời gian xử lý tham khảo: 1 ngày.",
    "next_step_summary": "Nên xác định rõ đối tượng tham gia, quyền lợi hoặc nhu cầu điều chỉnh hồ sơ y tế trước khi nộp. Có thể chọn kênh nộp phù hợp: Trực tiếp, Trực tuyến, Dịch vụ bưu chính. Hiện có 1 mục giấy tờ cần theo dõi trong checklist.",
    "tone": "supportive_public_service"
  },
  "guidance": {
    "highlight_documents": [
      {
        "bucket": "required",
        "name": "Tờ khai điện tử theo mẫu ban hành kèm theo Nghị định số 318/2025/NĐ-CP.",
        "conditions": [],
        "attachment_path": "file:///C:/Users/ku060/Downloads/VAIC source/data-pipeline/raw_data/1_115305/T%E1%BB%9D%20khai%20k%C3%A8m%20theo%20ND318.doc"
      }
    ],
    "special_cases": [],
    "common_errors": [
      "Điền sai mẫu tờ khai hoặc chọn sai biểu mẫu đi kèm."
    ],
    "validation_hints": [
      "Nên xác định trước kênh nộp hồ sơ để biết có cần bản giấy, bản điện tử hay xuất trình trực tiếp.",
      "Có mẫu biểu đính kèm, nên kiểm tra đúng biểu mẫu trước khi nộp.",
      "Nên xác định đúng nhóm đối tượng, mã số bảo hiểm và quyền lợi áp dụng trước khi nộp."
    ]
  },
  "intake": {
    "candidate_input_fields": [
      {
        "field_id": "request_subject",
        "label": "Đối tượng làm thủ tục",
        "field_type": "text",
        "required": true
      },
      {
        "field_id": "insurance_or_medical_need",
        "label": "Nhu cầu bảo hiểm hoặc y tế",
        "field_type": "text",
        "required": true
      },
      {
        "field_id": "submission_channel_preference",
        "label": "Kênh nộp dự kiến",
        "field_type": "enum",
        "required": false
      },
      {
        "field_id": "has_insurance_number",
        "label": "Đã có mã BHXH/BHYT",
        "field_type": "boolean",
        "required": false
      }
    ],
    "suggested_clarifying_questions": [
      "Bạn đang muốn đăng ký, điều chỉnh hay xác nhận quyền lợi y tế hoặc bảo hiểm nào?",
      "Bạn đã có mã BHXH/BHYT hoặc thông tin đơn vị tiếp nhận liên quan chưa?"
    ]
  },
  "ui_hints": {
    "primary_channel": "online",
    "result_label": "- Nếu đăng ký không thành công hệ thống phản hồi lý do",
    "time_badge": "1 ngày",
    "document_count_badge": 1
  },
  "provenance": {
    "generator": "workflow_domain_enricher",
    "derivation_mode": "rule_based_semantic_enrichment",
    "supported_group": true
  }
}