{
  "schema_version": "1.0",
  "enricher_version": "0.2.0",
  "source": {
    "procedure_code": "6.005714",
    "title": "Thủ tục cấp đổi, cấp lại hiện vật khen thưởng thuộc thẩm quyền của Bộ trưởng Bộ Xây dựng",
    "group_key": "dien_luc_nha_o_dat_dai",
    "workflow_family": null,
    "subflow": null
  },
  "experience": {
    "entry_label": "Hỗ trợ nhà ở, đất đai và điện lực",
    "overview_summary": "Thủ tục này thuộc nhóm nhà ở, đất đai và điện lực, thường cần kiểm tra hiện trạng hồ sơ tài sản hoặc điều kiện hạ tầng liên quan. Kết quả thường nhận được là - Giấy chứng nhận cấp đổi/cấp lại hiện vật khen thưởng thuộc thẩm quyền của Bộ Xây dựng. Thời gian xử lý tham khảo: 15 ngày.",
    "next_step_summary": "Nên chuẩn bị trước thông tin thửa đất, tài sản hoặc địa điểm tiếp nhận, rồi chọn kênh nộp phù hợp: Trực tiếp, Trực tuyến, Dịch vụ bưu chính. Hiện có 1 mục giấy tờ cần theo dõi trong checklist.",
    "tone": "supportive_public_service"
  },
  "guidance": {
    "highlight_documents": [
      {
        "bucket": "conditional",
        "name": "Công văn đề nghị cấp đổi/cấp lại hiện vật khen thưởng của tập thể hoặc Đơn đề nghị cấp đổi/cấp lại hiện vật khen thưởng của cá nhân, hộ gia đình; - Danh sách đề nghị cấp đổi/cấp lại hiện vật khen thưởng; - Hiện vật khen thưởng đề nghị cấp đổi (đối với trường hợp đề nghị cấp đổi). b) Số lượng hồ sơ: 01 bộ.",
        "conditions": [
          "Công văn đề nghị cấp đổi/cấp lại hiện vật khen thưởng của tập thể hoặc Đơn đề nghị cấp đổi/cấp lại hiện vật khen thưởng của cá nhân, hộ gia đình; - Danh sách đề nghị cấp đổi/cấp lại hiện vật khen thưởng; - Hiện vật khen thưởng đề nghị cấp đổi (đối với trường hợp đề nghị cấp đổi). b) Số lượng hồ sơ: 01 bộ."
        ],
        "attachment_path": "file:///C:/Users/ku060/Downloads/VAIC source/data-pipeline/raw_data/6_005714/M%E1%BA%ABu%20s%E1%BB%91%202.1.docx"
      }
    ],
    "special_cases": [],
    "common_errors": [],
    "validation_hints": [
      "Nên xác định trước kênh nộp hồ sơ để biết có cần bản giấy, bản điện tử hay xuất trình trực tiếp.",
      "Có mẫu biểu đính kèm, nên kiểm tra đúng biểu mẫu trước khi nộp.",
      "Nên đối chiếu trước thông tin thửa đất, tài sản hoặc hiện trạng hồ sơ để tránh bị yêu cầu chỉnh sửa."
    ]
  },
  "intake": {
    "candidate_input_fields": [
      {
        "field_id": "property_or_service_need",
        "label": "Nhu cầu về đất đai, nhà ở hoặc điện lực",
        "field_type": "text",
        "required": true
      },
      {
        "field_id": "property_location",
        "label": "Địa điểm tài sản hoặc nơi sử dụng dịch vụ",
        "field_type": "text",
        "required": true
      },
      {
        "field_id": "submission_channel_preference",
        "label": "Kênh nộp dự kiến",
        "field_type": "enum",
        "required": false
      },
      {
        "field_id": "has_current_certificate",
        "label": "Đã có giấy tờ/tài liệu hiện trạng",
        "field_type": "boolean",
        "required": false
      }
    ],
    "suggested_clarifying_questions": [
      "Bạn đang xử lý nhu cầu nào về đất đai, nhà ở hoặc điện lực?",
      "Bạn đã có thông tin thửa đất, địa chỉ tài sản hoặc giấy tờ hiện trạng chưa?"
    ]
  },
  "ui_hints": {
    "primary_channel": "in_person",
    "result_label": "- Giấy chứng nhận cấp đổi/cấp lại hiện vật khen thưởng thuộc thẩm quyền của Bộ Xây dựng",
    "time_badge": "15 ngày",
    "document_count_badge": 1
  },
  "provenance": {
    "generator": "workflow_domain_enricher",
    "derivation_mode": "rule_based_semantic_enrichment",
    "supported_group": true
  }
}