{
  "schema_version": "1.0",
  "enricher_version": "0.2.0",
  "source": {
    "procedure_code": "1.001912",
    "title": "Xét tốt nghiệp và cấp bằng thạc sĩ, bảng điểm",
    "group_key": "hoc_tap",
    "workflow_family": "education_study_workflow",
    "subflow": "van_bang_chung_chi"
  },
  "experience": {
    "entry_label": "Hỗ trợ giáo dục và học tập",
    "overview_summary": "Thủ tục này thuộc nhóm giáo dục và học tập, thường liên quan đến hồ sơ đào tạo, văn bằng hoặc điều kiện học tập của người học. Kết quả thường nhận được là kết quả giải quyết theo thủ tục này. Thời gian xử lý tham khảo: theo thời hạn của cơ quan xử lý.",
    "next_step_summary": "Nên rà trước thông tin người học, cơ sở đào tạo và loại kết quả cần xin xác nhận hoặc cấp lại. Có thể chọn kênh nộp phù hợp: Trực tiếp. Hiện có 1 mục giấy tờ cần theo dõi trong checklist.",
    "tone": "supportive_public_service"
  },
  "guidance": {
    "highlight_documents": [
      {
        "bucket": "required",
        "name": "Không quy định cụ thể. Tên giấy tờ Mẫu đơn, tờ khai Số lượng Không quy định cụ thể.",
        "conditions": [],
        "attachment_path": null
      }
    ],
    "special_cases": [],
    "common_errors": [
      "Điền sai mẫu tờ khai hoặc chọn sai biểu mẫu đi kèm."
    ],
    "validation_hints": [
      "Nên xác định trước kênh nộp hồ sơ để biết có cần bản giấy, bản điện tử hay xuất trình trực tiếp.",
      "Nên rà lại thông tin người học, cơ sở đào tạo và loại xác nhận hoặc văn bằng cần xin."
    ]
  },
  "intake": {
    "candidate_input_fields": [
      {
        "field_id": "learner_full_name",
        "label": "Tên người học",
        "field_type": "text",
        "required": true
      },
      {
        "field_id": "education_record_type",
        "label": "Loại hồ sơ học tập cần xử lý",
        "field_type": "text",
        "required": true
      },
      {
        "field_id": "education_institution",
        "label": "Cơ sở đào tạo liên quan",
        "field_type": "text",
        "required": false
      },
      {
        "field_id": "submission_channel_preference",
        "label": "Kênh nộp dự kiến",
        "field_type": "enum",
        "required": false
      },
      {
        "field_id": "certificate_or_degree_type",
        "label": "Loại văn bằng/chứng chỉ",
        "field_type": "text",
        "required": false
      }
    ],
    "suggested_clarifying_questions": [
      "Bạn đang cần xử lý hồ sơ học tập, văn bằng hay xác nhận nào?",
      "Người học và cơ sở đào tạo liên quan đã xác định rõ chưa?"
    ]
  },
  "ui_hints": {
    "primary_channel": "in_person",
    "result_label": null,
    "time_badge": null,
    "document_count_badge": 1
  },
  "provenance": {
    "generator": "workflow_domain_enricher",
    "derivation_mode": "rule_based_semantic_enrichment",
    "supported_group": true
  }
}