{
  "schema_version": "1.0",
  "enricher_version": "0.2.0",
  "source": {
    "procedure_code": "1.115713",
    "title": "Đăng ký biến động đối với trường hợp thành viên của hộ gia đình hoặc cá nhân đang sử dụng đất thành lập doanh nghiệp tư nhân và sử dụng đất vào hoạt động sản xuất kinh doanh của doanh nghiệp",
    "group_key": "dien_luc_nha_o_dat_dai",
    "workflow_family": null,
    "subflow": null
  },
  "experience": {
    "entry_label": "Hỗ trợ nhà ở, đất đai và điện lực",
    "overview_summary": "Thủ tục này thuộc nhóm nhà ở, đất đai và điện lực, thường cần kiểm tra hiện trạng hồ sơ tài sản hoặc điều kiện hạ tầng liên quan. Kết quả thường nhận được là Giấy chứng nhận quyền sử dụng đất, quyền sở hữu tài sản gắn liền với đất. Thời gian xử lý tham khảo: Không quá 10 ngày làm việc ngày.",
    "next_step_summary": "Nên chuẩn bị trước thông tin thửa đất, tài sản hoặc địa điểm tiếp nhận, rồi chọn kênh nộp phù hợp: Trực tiếp, Trực tuyến, Dịch vụ bưu chính. Hiện có khoảng 7 mục giấy tờ cần theo dõi trong checklist.",
    "tone": "supportive_public_service"
  },
  "guidance": {
    "highlight_documents": [
      {
        "bucket": "required",
        "name": "Mẫu số 24. Đơn đăng ký biến động đất đai, tài sản gắn liền với đất",
        "conditions": [],
        "attachment_path": "file:///C:/Users/ku060/Downloads/VAIC source/data-pipeline/raw_data/1_115713/M%E1%BA%ABu%20s%E1%BB%91%2024.docx"
      },
      {
        "bucket": "required",
        "name": "Giấy chứng nhận đã cấp.",
        "conditions": [],
        "attachment_path": null
      },
      {
        "bucket": "required",
        "name": "Giấy chứng nhận đăng ký doanh nghiệp.",
        "conditions": [],
        "attachment_path": null
      },
      {
        "bucket": "conditional",
        "name": "Văn bản thỏa thuận của các thành viên trong hộ gia đình có chung quyền sử dụng đất đồng ý đưa quyền sử dụng đất vào doanh nghiệp đã được công chứng hoặc chứng thực theo quy định của pháp luật đối với trường hợp quyền sử dụng đất của hộ gia đình.",
        "conditions": [
          "Văn bản thỏa thuận của các thành viên trong hộ gia đình có chung quyền sử dụng đất đồng ý đưa quyền sử dụng đất vào doanh nghiệp đã được công chứng hoặc chứng thực theo quy định của pháp luật đối với trường hợp quyền sử dụng đất của hộ gia đình."
        ],
        "attachment_path": null
      },
      {
        "bucket": "conditional",
        "name": "Đơn đề nghị tách thửa đất, hợp thửa đất; Bản vẽ tách thửa đất, hợp thửa đất đối với trường hợp đăng ký biến động đất đai mà phải tách thửa đất, hợp thửa đất.",
        "conditions": [
          "Đơn đề nghị tách thửa đất, hợp thửa đất; Bản vẽ tách thửa đất, hợp thửa đất đối với trường hợp đăng ký biến động đất đai mà phải tách thửa đất, hợp thửa đất."
        ],
        "attachment_path": null
      },
      {
        "bucket": "conditional",
        "name": "Mảnh trích đo bản đồ địa chính thửa đất đối với trường hợp người sử dụng đất có nhu cầu đo đạc để xác định lại kích thước các cạnh, diện tích của thửa đất.",
        "conditions": [
          "Mảnh trích đo bản đồ địa chính thửa đất đối với trường hợp người sử dụng đất có nhu cầu đo đạc để xác định lại kích thước các cạnh, diện tích của thửa đất."
        ],
        "attachment_path": null
      }
    ],
    "special_cases": [
      "Có thể cần đối chiếu thông tin thửa đất hoặc giấy chứng nhận"
    ],
    "common_errors": [
      "Điền sai mẫu tờ khai hoặc chọn sai biểu mẫu đi kèm.",
      "Thông tin thửa đất, tài sản hoặc giấy chứng nhận chưa khớp với hồ sơ hiện có."
    ],
    "validation_hints": [
      "Nên xác định trước kênh nộp hồ sơ để biết có cần bản giấy, bản điện tử hay xuất trình trực tiếp.",
      "Có mẫu biểu đính kèm, nên kiểm tra đúng biểu mẫu trước khi nộp.",
      "Nên đối chiếu trước thông tin thửa đất, tài sản hoặc hiện trạng hồ sơ để tránh bị yêu cầu chỉnh sửa."
    ]
  },
  "intake": {
    "candidate_input_fields": [
      {
        "field_id": "property_or_service_need",
        "label": "Nhu cầu về đất đai, nhà ở hoặc điện lực",
        "field_type": "text",
        "required": true
      },
      {
        "field_id": "property_location",
        "label": "Địa điểm tài sản hoặc nơi sử dụng dịch vụ",
        "field_type": "text",
        "required": true
      },
      {
        "field_id": "submission_channel_preference",
        "label": "Kênh nộp dự kiến",
        "field_type": "enum",
        "required": false
      },
      {
        "field_id": "has_current_certificate",
        "label": "Đã có giấy tờ/tài liệu hiện trạng",
        "field_type": "boolean",
        "required": false
      }
    ],
    "suggested_clarifying_questions": [
      "Bạn đang xử lý nhu cầu nào về đất đai, nhà ở hoặc điện lực?",
      "Bạn đã có thông tin thửa đất, địa chỉ tài sản hoặc giấy tờ hiện trạng chưa?"
    ]
  },
  "ui_hints": {
    "primary_channel": "in_person",
    "result_label": "Giấy chứng nhận quyền sử dụng đất, quyền sở hữu tài sản gắn liền với đất",
    "time_badge": "Không quá 10 ngày làm việc ngày",
    "document_count_badge": 7
  },
  "provenance": {
    "generator": "workflow_domain_enricher",
    "derivation_mode": "rule_based_semantic_enrichment",
    "supported_group": true
  }
}