{
  "schema_version": "1.0",
  "enricher_version": "0.2.0",
  "source": {
    "procedure_code": "1.014866",
    "title": "Đề nghị chấp thuận thiết kế nút giao đấu nối vào đường bộ đang khai thác do Sở Xây dựng quản lý",
    "group_key": "dien_luc_nha_o_dat_dai",
    "workflow_family": null,
    "subflow": null
  },
  "experience": {
    "entry_label": "Hỗ trợ nhà ở, đất đai và điện lực",
    "overview_summary": "Thủ tục này thuộc nhóm nhà ở, đất đai và điện lực, thường cần kiểm tra hiện trạng hồ sơ tài sản hoặc điều kiện hạ tầng liên quan. Kết quả thường nhận được là Công văn chấp thuận thiết kế nút giao đấu nối vào đường bộ đang khai thác do Sở Xây dựng quản lý. Thời gian xử lý tham khảo: 5 ngày làm việc.",
    "next_step_summary": "Nên chuẩn bị trước thông tin thửa đất, tài sản hoặc địa điểm tiếp nhận, rồi chọn kênh nộp phù hợp: Trực tiếp, Trực tuyến, Dịch vụ bưu chính. Hiện có khoảng 3 mục giấy tờ cần theo dõi trong checklist.",
    "tone": "supportive_public_service"
  },
  "guidance": {
    "highlight_documents": [
      {
        "bucket": "required",
        "name": "Đơn đề nghị chấp thuận thiết kế kỹ thuật của nút giao theo mẫu tại Phụ lục 1 ban hành kèm theo Quyết định số 11/2026/QĐ-UBND ngày 11 tháng 02 năm 2026 của Ủy ban nhân dân tỉnh Vĩnh Long",
        "conditions": [],
        "attachment_path": "file:///C:/Users/ku060/Downloads/VAIC source/data-pipeline/raw_data/1_014866/Maudon-DenghichapthuanthietkenutgiaodaunoiduongbothuocquanlySXD.docx"
      },
      {
        "bucket": "required",
        "name": "Văn bản của cơ quan Nhà nước có thẩm quyền giao tổ chức, cá nhân làm chủ đầu tư, chủ sử dụng nút giao hoặc giấy chứng nhận quyền sử dụng đất hoặc hợp đồng cho thuê đất tại vị trí nút giao",
        "conditions": [],
        "attachment_path": null
      },
      {
        "bucket": "required",
        "name": "Thiết kế kỹ thuật và phương án tổ chức giao thông của nút giao (có biện pháp tổ chức thi công bảo đảm an toàn giao thông) do tổ chức tư vấn được phép hành nghề trong lĩnh vực công trình đường bộ lập.",
        "conditions": [],
        "attachment_path": null
      }
    ],
    "special_cases": [
      "Có thể cần đối chiếu thông tin thửa đất hoặc giấy chứng nhận"
    ],
    "common_errors": [
      "Điền sai mẫu tờ khai hoặc chọn sai biểu mẫu đi kèm.",
      "Thông tin thửa đất, tài sản hoặc giấy chứng nhận chưa khớp với hồ sơ hiện có."
    ],
    "validation_hints": [
      "Nên xác định trước kênh nộp hồ sơ để biết có cần bản giấy, bản điện tử hay xuất trình trực tiếp.",
      "Có mẫu biểu đính kèm, nên kiểm tra đúng biểu mẫu trước khi nộp.",
      "Nên đối chiếu trước thông tin thửa đất, tài sản hoặc hiện trạng hồ sơ để tránh bị yêu cầu chỉnh sửa."
    ]
  },
  "intake": {
    "candidate_input_fields": [
      {
        "field_id": "property_or_service_need",
        "label": "Nhu cầu về đất đai, nhà ở hoặc điện lực",
        "field_type": "text",
        "required": true
      },
      {
        "field_id": "property_location",
        "label": "Địa điểm tài sản hoặc nơi sử dụng dịch vụ",
        "field_type": "text",
        "required": true
      },
      {
        "field_id": "submission_channel_preference",
        "label": "Kênh nộp dự kiến",
        "field_type": "enum",
        "required": false
      },
      {
        "field_id": "has_current_certificate",
        "label": "Đã có giấy tờ/tài liệu hiện trạng",
        "field_type": "boolean",
        "required": false
      }
    ],
    "suggested_clarifying_questions": [
      "Bạn đang xử lý nhu cầu nào về đất đai, nhà ở hoặc điện lực?",
      "Bạn đã có thông tin thửa đất, địa chỉ tài sản hoặc giấy tờ hiện trạng chưa?"
    ]
  },
  "ui_hints": {
    "primary_channel": "in_person",
    "result_label": "Công văn chấp thuận thiết kế nút giao đấu nối vào đường bộ đang khai thác do Sở Xây dựng quản lý",
    "time_badge": "5 ngày làm việc",
    "document_count_badge": 3
  },
  "provenance": {
    "generator": "workflow_domain_enricher",
    "derivation_mode": "rule_based_semantic_enrichment",
    "supported_group": true
  }
}