{
  "schema_version": "1.0",
  "enricher_version": "0.2.0",
  "source": {
    "procedure_code": "2.000769",
    "title": "Cấp lại Chứng chỉ bồi dưỡng kiến thức pháp luật về giao thông đường bộ cho người điều khiển xe máy chuyên dùng tham gia giao thông đường bộ (trường hợp cơ sở bồi dưỡng đã cấp chứng chỉ không còn hoạt động)",
    "group_key": "hoc_tap",
    "workflow_family": null,
    "subflow": null
  },
  "experience": {
    "entry_label": "Hỗ trợ giáo dục và học tập",
    "overview_summary": "Thủ tục này thuộc nhóm giáo dục và học tập, thường liên quan đến hồ sơ đào tạo, văn bằng hoặc điều kiện học tập của người học. Kết quả thường nhận được là Chứng chỉ bồi dưỡng kiến thức pháp luật về giao thông đường bộ. Thời gian xử lý tham khảo: 2 ngày làm việc.",
    "next_step_summary": "Nên rà trước thông tin người học, cơ sở đào tạo và loại kết quả cần xin xác nhận hoặc cấp lại. Có thể chọn kênh nộp phù hợp: Trực tiếp, Trực tuyến, Dịch vụ bưu chính. Hiện có khoảng 2 mục giấy tờ cần theo dõi trong checklist.",
    "tone": "supportive_public_service"
  },
  "guidance": {
    "highlight_documents": [
      {
        "bucket": "required",
        "name": "03 ảnh màu kích thước 2x3 cm chụp không quá 06 tháng",
        "conditions": [],
        "attachment_path": null
      },
      {
        "bucket": "required",
        "name": "Đơn đề nghị cấp lại chứng chỉ theo mẫu quy định TT số 17/2026/TT-BXD sửa đổi TT 14/2025/TT-BXD quy định về đào tạo lái xe; bồi dưỡng, kiểm tra, cấp chứng chỉ bồi dưỡng kiến thức pháp luật về giao thông đường bộ",
        "conditions": [],
        "attachment_path": "file:///C:/Users/ku060/Downloads/VAIC source/data-pipeline/raw_data/2_000769/G17.000061_2.000769_TT17.2026.docx"
      }
    ],
    "special_cases": [],
    "common_errors": [
      "Điền sai mẫu tờ khai hoặc chọn sai biểu mẫu đi kèm."
    ],
    "validation_hints": [
      "Nên xác định trước kênh nộp hồ sơ để biết có cần bản giấy, bản điện tử hay xuất trình trực tiếp.",
      "Có mẫu biểu đính kèm, nên kiểm tra đúng biểu mẫu trước khi nộp.",
      "Nên rà lại thông tin người học, cơ sở đào tạo và loại xác nhận hoặc văn bằng cần xin."
    ]
  },
  "intake": {
    "candidate_input_fields": [
      {
        "field_id": "learner_full_name",
        "label": "Tên người học",
        "field_type": "text",
        "required": true
      },
      {
        "field_id": "education_record_type",
        "label": "Loại hồ sơ học tập cần xử lý",
        "field_type": "text",
        "required": true
      },
      {
        "field_id": "education_institution",
        "label": "Cơ sở đào tạo liên quan",
        "field_type": "text",
        "required": false
      },
      {
        "field_id": "submission_channel_preference",
        "label": "Kênh nộp dự kiến",
        "field_type": "enum",
        "required": false
      }
    ],
    "suggested_clarifying_questions": [
      "Bạn đang cần xử lý hồ sơ học tập, văn bằng hay xác nhận nào?",
      "Người học và cơ sở đào tạo liên quan đã xác định rõ chưa?"
    ]
  },
  "ui_hints": {
    "primary_channel": "in_person",
    "result_label": "Chứng chỉ bồi dưỡng kiến thức pháp luật về giao thông đường bộ",
    "time_badge": "2 ngày làm việc",
    "document_count_badge": 2
  },
  "provenance": {
    "generator": "workflow_domain_enricher",
    "derivation_mode": "rule_based_semantic_enrichment",
    "supported_group": true
  }
}