{
  "schema_version": "1.0",
  "enricher_version": "0.2.0",
  "source": {
    "procedure_code": "1.115709",
    "title": "Chuyển hình thức sử dụng đất; gia hạn sử dụng đất khi hết thời hạn sử dụng đất; điều chỉnh thời hạn sử dụng đất",
    "group_key": "dien_luc_nha_o_dat_dai",
    "workflow_family": null,
    "subflow": null
  },
  "experience": {
    "entry_label": "Hỗ trợ nhà ở, đất đai và điện lực",
    "overview_summary": "Thủ tục này thuộc nhóm nhà ở, đất đai và điện lực, thường cần kiểm tra hiện trạng hồ sơ tài sản hoặc điều kiện hạ tầng liên quan. Kết quả thường nhận được là Quyết định cho phép chuyển mục đích sử dụng đất, chuyển hình thức sử dụng đất, gia hạn sử dụng đất, điều chỉnh thời hạn sử dụng đất. Thời gian xử lý tham khảo: 15 ngày.",
    "next_step_summary": "Nên chuẩn bị trước thông tin thửa đất, tài sản hoặc địa điểm tiếp nhận, rồi chọn kênh nộp phù hợp: Trực tiếp, Trực tuyến, Dịch vụ bưu chính. Hiện có khoảng 14 mục giấy tờ cần theo dõi trong checklist.",
    "tone": "supportive_public_service"
  },
  "guidance": {
    "highlight_documents": [
      {
        "bucket": "required",
        "name": "Mẫu số 02-Đơn đề nghị chuyển hình thức giao đất/cho thuê đất",
        "conditions": [],
        "attachment_path": "file:///C:/Users/ku060/Downloads/VAIC source/data-pipeline/raw_data/1_115709/M%E1%BA%ABu%20s%E1%BB%91%2002.doc"
      },
      {
        "bucket": "required",
        "name": "Một trong các giấy chứng nhận quy định tại khoản 21 Điều 3, khoản 3 Điều 256 Luật Đất đai hoặc một trong các loại giấy tờ quy định tại Điều 137 Luật Đất đai hoặc quyết định giao đất, cho thuê đất, cho phép chuyển mục đích sử dụng đất của cơ quan nhà nước có thẩm quyền theo quy định của pháp luật về đất đai qua các thời kỳ.",
        "conditions": [],
        "attachment_path": null
      },
      {
        "bucket": "required",
        "name": "Quyết định giao đất, quyết định cho thuê đất, quyết định cho phép chuyển mục đích sử dụng đất của cơ quan nhà nước có thẩm quyền theo quy định của pháp luật đất đai qua các thời kỳ",
        "conditions": [],
        "attachment_path": null
      },
      {
        "bucket": "required",
        "name": "Bản trích lục bản đồ địa chính hoặc trích đo bản đồ địa chính.",
        "conditions": [],
        "attachment_path": null
      },
      {
        "bucket": "required",
        "name": "Mẫu số 04. Đơn đề nghị gia hạn sử dụng đất",
        "conditions": [],
        "attachment_path": "file:///C:/Users/ku060/Downloads/VAIC source/data-pipeline/raw_data/1_115709/M%E1%BA%ABu%20s%E1%BB%91%2004.doc"
      },
      {
        "bucket": "required",
        "name": "Một trong các giấy chứng nhận quy định tại khoản 21 Điều 3, khoản 3 Điều 256 Luật Đất đai hoặc một trong các loại giấy tờ quy định tại Điều 137 Luật Đất đai hoặc quyết định giao đất, cho thuê đất, cho phép chuyển mục đích sử dụng đất của cơ quan nhà nước có thẩm quyền theo quy định của pháp luật về đất đai qua các thời kỳ.",
        "conditions": [],
        "attachment_path": null
      }
    ],
    "special_cases": [
      "Có thể cần đối chiếu thông tin thửa đất hoặc giấy chứng nhận"
    ],
    "common_errors": [
      "Điền sai mẫu tờ khai hoặc chọn sai biểu mẫu đi kèm.",
      "Thông tin thửa đất, tài sản hoặc giấy chứng nhận chưa khớp với hồ sơ hiện có."
    ],
    "validation_hints": [
      "Nên xác định trước kênh nộp hồ sơ để biết có cần bản giấy, bản điện tử hay xuất trình trực tiếp.",
      "Có mẫu biểu đính kèm, nên kiểm tra đúng biểu mẫu trước khi nộp.",
      "Nên đối chiếu trước thông tin thửa đất, tài sản hoặc hiện trạng hồ sơ để tránh bị yêu cầu chỉnh sửa."
    ]
  },
  "intake": {
    "candidate_input_fields": [
      {
        "field_id": "property_or_service_need",
        "label": "Nhu cầu về đất đai, nhà ở hoặc điện lực",
        "field_type": "text",
        "required": true
      },
      {
        "field_id": "property_location",
        "label": "Địa điểm tài sản hoặc nơi sử dụng dịch vụ",
        "field_type": "text",
        "required": true
      },
      {
        "field_id": "submission_channel_preference",
        "label": "Kênh nộp dự kiến",
        "field_type": "enum",
        "required": false
      },
      {
        "field_id": "has_current_certificate",
        "label": "Đã có giấy tờ/tài liệu hiện trạng",
        "field_type": "boolean",
        "required": false
      }
    ],
    "suggested_clarifying_questions": [
      "Bạn đang xử lý nhu cầu nào về đất đai, nhà ở hoặc điện lực?",
      "Bạn đã có thông tin thửa đất, địa chỉ tài sản hoặc giấy tờ hiện trạng chưa?"
    ]
  },
  "ui_hints": {
    "primary_channel": "online",
    "result_label": "Quyết định cho phép chuyển mục đích sử dụng đất, chuyển hình thức sử dụng đất, gia hạn sử dụng đất, điều chỉnh thời hạn sử dụng đất",
    "time_badge": "15 ngày",
    "document_count_badge": 14
  },
  "provenance": {
    "generator": "workflow_domain_enricher",
    "derivation_mode": "rule_based_semantic_enrichment",
    "supported_group": true
  }
}