{
  "schema_version": "1.0",
  "enricher_version": "0.2.0",
  "source": {
    "procedure_code": "1.115637",
    "title": "Đăng ký, cấp Giấy chứng nhận đối với trường hợp hộ gia đình, cá nhân đang sử dụng đất không đúng mục đích đã được Nhà nước công nhận quyền sử dụng đất trước ngày 01 tháng 7 năm 2014",
    "group_key": "dien_luc_nha_o_dat_dai",
    "workflow_family": null,
    "subflow": null
  },
  "experience": {
    "entry_label": "Hỗ trợ nhà ở, đất đai và điện lực",
    "overview_summary": "Thủ tục này thuộc nhóm đất đai và nhà ở, thường dùng để cấp, đổi hoặc cập nhật giấy chứng nhận và thông tin tài sản gắn liền với đất. Kết quả thường nhận được là Giấy chứng nhận. Thời gian xử lý tham khảo: 6 ngày làm việc.",
    "next_step_summary": "Nên chuẩn bị trước thông tin thửa đất, tài sản hoặc địa điểm tiếp nhận, rồi chọn kênh nộp phù hợp: Trực tiếp, Trực tuyến, Dịch vụ bưu chính. Hiện có khoảng 5 mục giấy tờ cần theo dõi trong checklist.",
    "tone": "supportive_public_service"
  },
  "guidance": {
    "highlight_documents": [
      {
        "bucket": "required",
        "name": "Đơn đăng ký biến động đất đai, tài sản gắn liền với đất theo Mẫu số 24 Phụ lục số 04 ban hành kèm theo Quyết định số 52/2026/QĐ-UBND",
        "conditions": [],
        "attachment_path": "file:///C:/Users/ku060/Downloads/VAIC source/data-pipeline/raw_data/1_115637/M%E1%BA%ABu%2024.pdf"
      },
      {
        "bucket": "required",
        "name": "Giấy chứng nhận đã cấp",
        "conditions": [],
        "attachment_path": null
      },
      {
        "bucket": "required",
        "name": "Quyết định xử phạt vi phạm hành chính trong lĩnh vực đất đai; chứng từ nộp phạt của người sử dụng đất",
        "conditions": [],
        "attachment_path": null
      },
      {
        "bucket": "conditional",
        "name": "Mảnh trích đo bản đồ địa chính thửa đất đối với trường hợp người sử dụng đất có nhu cầu đo đạc để xác định lại kích thước các cạnh, diện tích của thửa đất.",
        "conditions": [
          "Mảnh trích đo bản đồ địa chính thửa đất đối với trường hợp người sử dụng đất có nhu cầu đo đạc để xác định lại kích thước các cạnh, diện tích của thửa đất."
        ],
        "attachment_path": null
      },
      {
        "bucket": "conditional",
        "name": "Văn bản về việc đại diện theo quy định của pháp luật về dân sự đối với trường hợp thực hiện thủ tục đăng ký đất đai, tài sản gắn liền với đất thông qua người đại diện",
        "conditions": [
          "Văn bản về việc đại diện theo quy định của pháp luật về dân sự đối với trường hợp thực hiện thủ tục đăng ký đất đai, tài sản gắn liền với đất thông qua người đại diện"
        ],
        "attachment_path": null
      }
    ],
    "special_cases": [
      "Có thể cần đối chiếu thông tin thửa đất hoặc giấy chứng nhận"
    ],
    "common_errors": [
      "Điền sai mẫu tờ khai hoặc chọn sai biểu mẫu đi kèm.",
      "Thông tin thửa đất, tài sản hoặc giấy chứng nhận chưa khớp với hồ sơ hiện có."
    ],
    "validation_hints": [
      "Nên xác định trước kênh nộp hồ sơ để biết có cần bản giấy, bản điện tử hay xuất trình trực tiếp.",
      "Có mẫu biểu đính kèm, nên kiểm tra đúng biểu mẫu trước khi nộp.",
      "Nên đối chiếu trước thông tin thửa đất, tài sản hoặc hiện trạng hồ sơ để tránh bị yêu cầu chỉnh sửa."
    ]
  },
  "intake": {
    "candidate_input_fields": [
      {
        "field_id": "property_or_service_need",
        "label": "Nhu cầu về đất đai, nhà ở hoặc điện lực",
        "field_type": "text",
        "required": true
      },
      {
        "field_id": "property_location",
        "label": "Địa điểm tài sản hoặc nơi sử dụng dịch vụ",
        "field_type": "text",
        "required": true
      },
      {
        "field_id": "submission_channel_preference",
        "label": "Kênh nộp dự kiến",
        "field_type": "enum",
        "required": false
      },
      {
        "field_id": "has_current_certificate",
        "label": "Đã có giấy tờ/tài liệu hiện trạng",
        "field_type": "boolean",
        "required": false
      },
      {
        "field_id": "certificate_status",
        "label": "Tình trạng giấy chứng nhận hiện tại",
        "field_type": "enum",
        "required": false
      },
      {
        "field_id": "land_plot_identifier",
        "label": "Thông tin thửa đất",
        "field_type": "text",
        "required": false
      }
    ],
    "suggested_clarifying_questions": [
      "Bạn đang xử lý nhu cầu nào về đất đai, nhà ở hoặc điện lực?",
      "Bạn đã có thông tin thửa đất, địa chỉ tài sản hoặc giấy tờ hiện trạng chưa?"
    ]
  },
  "ui_hints": {
    "primary_channel": "in_person",
    "result_label": "Giấy chứng nhận",
    "time_badge": "6 ngày làm việc",
    "document_count_badge": 5
  },
  "provenance": {
    "generator": "workflow_domain_enricher",
    "derivation_mode": "rule_based_semantic_enrichment",
    "supported_group": true
  }
}