{
  "schema_version": "1.0",
  "enricher_version": "0.2.0",
  "source": {
    "procedure_code": "1.013151",
    "title": "Thủ tục thực hiện chế độ một lần đối với đối tượng hạ sĩ quan, chiến sĩ quân đội theo Quyết định 188/2007/QĐ-TTg (đối tượng cư trú ở địa phương khác không còn lưu giữ được giấy tờ)",
    "group_key": "cu_tru_giay_to",
    "workflow_family": null,
    "subflow": null
  },
  "experience": {
    "entry_label": "Hỗ trợ cư trú và giấy tờ",
    "overview_summary": "Thủ tục này thuộc nhóm cư trú và giấy tờ, thường cần kiểm tra thông tin định danh hoặc hồ sơ giấy tờ chuyên ngành. Kết quả thường nhận được là Quyết định hành chính. Thời gian xử lý tham khảo: 1 ngày.",
    "next_step_summary": "Nên kiểm tra trước giấy tờ định danh, nơi nộp và mẫu biểu liên quan, rồi chọn kênh nộp phù hợp: Trực tiếp, Trực tuyến, Dịch vụ bưu chính. Hiện có 1 mục giấy tờ cần theo dõi trong checklist.",
    "tone": "supportive_public_service"
  },
  "guidance": {
    "highlight_documents": [
      {
        "bucket": "required",
        "name": "Bản khai cá nhân hoặc Bản khai thân nhân (phải kèm theo giấy uỷ quyền của các thân nhân chủ yếu khác), có xác nhận của chính quyền xã nơi cư trú;",
        "conditions": [],
        "attachment_path": null
      }
    ],
    "special_cases": [
      "Có kiểm tra dữ liệu cư trú/định danh",
      "Có thể cần hồ sơ tử tuất hoặc mai táng phí"
    ],
    "common_errors": [],
    "validation_hints": [
      "Nên xác định trước kênh nộp hồ sơ để biết có cần bản giấy, bản điện tử hay xuất trình trực tiếp.",
      "Nên đối chiếu trước dữ liệu định danh và nơi cư trú để tránh bị yêu cầu bổ sung."
    ]
  },
  "intake": {
    "candidate_input_fields": [
      {
        "field_id": "document_request_type",
        "label": "Loại giấy tờ cần xử lý",
        "field_type": "text",
        "required": true
      },
      {
        "field_id": "submission_channel_preference",
        "label": "Kênh nộp dự kiến",
        "field_type": "enum",
        "required": false
      },
      {
        "field_id": "identity_document_available",
        "label": "Có giấy tờ định danh",
        "field_type": "boolean",
        "required": true
      },
      {
        "field_id": "residency_or_status_known",
        "label": "Biết rõ nơi cư trú hoặc tình trạng hiện tại",
        "field_type": "boolean",
        "required": false
      }
    ],
    "suggested_clarifying_questions": [
      "Bạn đang xử lý giấy tờ gì và muốn nộp trực tiếp hay trực tuyến?",
      "Thông tin định danh và nơi cư trú hiện tại đã sẵn sàng để đối chiếu chưa?"
    ]
  },
  "ui_hints": {
    "primary_channel": "online",
    "result_label": "Quyết định hành chính",
    "time_badge": "1 ngày",
    "document_count_badge": 1
  },
  "provenance": {
    "generator": "workflow_domain_enricher",
    "derivation_mode": "rule_based_semantic_enrichment",
    "supported_group": true
  }
}