{
  "schema_version": "1.0",
  "enricher_version": "0.2.0",
  "source": {
    "procedure_code": "2.000591",
    "title": "Cấp Giấy chứng nhận đủ điều kiện an toàn thực phẩm đối với cơ sở sản xuất, kinh doanh thực phẩm",
    "group_key": "suc_khoe_y_te",
    "workflow_family": null,
    "subflow": null
  },
  "experience": {
    "entry_label": "Hỗ trợ y tế và bảo hiểm",
    "overview_summary": "Thủ tục này thuộc nhóm y tế, thường cần đối chiếu thông tin người bệnh, đơn vị tiếp nhận hoặc quyền lợi chuyên ngành. Kết quả thường nhận được là GIẤY CHỨNG NHẬN CƠ SỞ ĐỦ ĐIỀU KIỆN AN TOÀN THỰC PHẨM. Thời gian xử lý tham khảo: 25 ngày làm việc.",
    "next_step_summary": "Nên xác định rõ đối tượng tham gia, quyền lợi hoặc nhu cầu điều chỉnh hồ sơ y tế trước khi nộp. Có thể chọn kênh nộp phù hợp: Trực tiếp, Trực tuyến, Dịch vụ bưu chính. Hiện có khoảng 7 mục giấy tờ cần theo dõi trong checklist.",
    "tone": "supportive_public_service"
  },
  "guidance": {
    "highlight_documents": [
      {
        "bucket": "required",
        "name": "Danh sách tổng hợp đủ sức khỏe do chủ cơ sở xác nhận hoặc giấy xác nhận đủ sức khỏe của chủ cơ sở và người trực tiếp sản xuất, kinh doanh thực phẩm do cơ sở y tế cấp huyện trở lên cấp;",
        "conditions": [],
        "attachment_path": null
      },
      {
        "bucket": "required",
        "name": "Giấy xác nhận đã được tập huấn kiến thức về an toàn thực phẩm của người trực tiếp sản xuất, kinh doanh thực phẩm có xác nhận của cơ sở.",
        "conditions": [],
        "attachment_path": null
      },
      {
        "bucket": "required",
        "name": "Bản thuyết minh về cơ sở vật chất, trang thiết bị, dụng cụ bảo đảm điều kiện vệ sinh an toàn thực phẩm theo Mẫu số 02a (đối với cơ sở sản xuất), Mẫu số 02b (đối với cơ sở kinh doanh) hoặc cả Mẫu số 02a và Mẫu số 02b (đối với cơ sở vừa sản xuất vừa kinh doanh) Mục I tại Phụ lục ban hành kèm theo Nghị định số 17/2020/NĐ-CP ngày 05 tháng 02 năm 2020 sửa đổi, bổ sung một số điều của các Nghị định liên quan đến điều khiện đầu tư kinh doanh thuộc lĩnh vực quản lý nhà nước của Bộ Công Thương;",
        "conditions": [],
        "attachment_path": "file:///C:/Users/ku060/Downloads/VAIC source/data-pipeline/raw_data/2_000591/M%E1%BA%ABu%20s%E1%BB%91%2002a.docx"
      },
      {
        "bucket": "required",
        "name": "Bảo sao Giấy chứng nhận đăng ký kinh doanh hoặc Giấy chứng nhận đăng ký doanh nghiệp hoặc Giấy chứng nhận đầu tư theo quy định của pháp luật.",
        "conditions": [],
        "attachment_path": null
      },
      {
        "bucket": "required",
        "name": "Đơn đề nghị theo Mẫu số 01a Mục I tại Phụ lục ban hành kèm theo Nghị định số 17/2020/NĐ-CP ngày 05 tháng 02 năm 2020 sửa đổi, bổ sung một số điều của các Nghị định liên quan đến điều kiện đầu tư kinh doanh thuộc lĩnh vực quản lý nhà nước của Bộ Công Thương;",
        "conditions": [],
        "attachment_path": "file:///C:/Users/ku060/Downloads/VAIC source/data-pipeline/raw_data/2_000591/M%E1%BA%ABu%20s%E1%BB%91%2001a.docx"
      },
      {
        "bucket": "required",
        "name": "Báo cáo kết quả khắc phục theo Mẫu số 04 Mục I tại Phụ lục ban hành kèm theo Nghị định số 17/2020/NĐ-CP ngày 05 tháng 02 năm 2020 sửa đổi, bổ sung một số điều của các Nghị định liên quan đến điều kiện đầu tư kinh doanh thuộc lĩnh vực quản lý nhà nước của Bộ Công Thương.",
        "conditions": [],
        "attachment_path": "file:///C:/Users/ku060/Downloads/VAIC source/data-pipeline/raw_data/2_000591/M%E1%BA%ABu%20s%E1%BB%91%2004%20%281%29.docx"
      }
    ],
    "special_cases": [
      "Có kiểm tra dữ liệu cư trú/định danh",
      "Có thể cần đối chiếu thông tin thửa đất hoặc giấy chứng nhận"
    ],
    "common_errors": [
      "Điền sai mẫu tờ khai hoặc chọn sai biểu mẫu đi kèm.",
      "Thông tin thửa đất, tài sản hoặc giấy chứng nhận chưa khớp với hồ sơ hiện có."
    ],
    "validation_hints": [
      "Nên xác định trước kênh nộp hồ sơ để biết có cần bản giấy, bản điện tử hay xuất trình trực tiếp.",
      "Có mẫu biểu đính kèm, nên kiểm tra đúng biểu mẫu trước khi nộp.",
      "Nên xác định đúng nhóm đối tượng, mã số bảo hiểm và quyền lợi áp dụng trước khi nộp."
    ]
  },
  "intake": {
    "candidate_input_fields": [
      {
        "field_id": "request_subject",
        "label": "Đối tượng làm thủ tục",
        "field_type": "text",
        "required": true
      },
      {
        "field_id": "insurance_or_medical_need",
        "label": "Nhu cầu bảo hiểm hoặc y tế",
        "field_type": "text",
        "required": true
      },
      {
        "field_id": "submission_channel_preference",
        "label": "Kênh nộp dự kiến",
        "field_type": "enum",
        "required": false
      },
      {
        "field_id": "has_insurance_number",
        "label": "Đã có mã BHXH/BHYT",
        "field_type": "boolean",
        "required": false
      }
    ],
    "suggested_clarifying_questions": [
      "Bạn đang muốn đăng ký, điều chỉnh hay xác nhận quyền lợi y tế hoặc bảo hiểm nào?",
      "Bạn đã có mã BHXH/BHYT hoặc thông tin đơn vị tiếp nhận liên quan chưa?"
    ]
  },
  "ui_hints": {
    "primary_channel": "online",
    "result_label": "GIẤY CHỨNG NHẬN CƠ SỞ ĐỦ ĐIỀU KIỆN AN TOÀN THỰC PHẨM",
    "time_badge": "25 ngày làm việc",
    "document_count_badge": 7
  },
  "provenance": {
    "generator": "workflow_domain_enricher",
    "derivation_mode": "rule_based_semantic_enrichment",
    "supported_group": true
  }
}