{
  "schema_version": "1.0",
  "enricher_version": "0.2.0",
  "source": {
    "procedure_code": "2.002027",
    "title": "Cấp Giấy phép hoạt động dịch vụ đưa người lao động Việt Nam đi làm việc ở nước ngoài theo hợp đồng",
    "group_key": "viec_lam",
    "workflow_family": null,
    "subflow": null
  },
  "experience": {
    "entry_label": "Hỗ trợ việc làm và lao động",
    "overview_summary": "Thủ tục này thuộc nhóm việc làm và lao động, thường cần kiểm tra hồ sơ nghề nghiệp, đơn vị sử dụng lao động hoặc điều kiện hưởng chế độ liên quan. Kết quả thường nhận được là Giấy phép hoạt động dịch vụ đưa người lao động Việt Nam đi làm việc ở nước ngoài theo hợp đồng. Thời gian xử lý tham khảo: 15 ngày.",
    "next_step_summary": "Nên xác định rõ nhu cầu lao động, hồ sơ nghề nghiệp hoặc chế độ cần giải quyết trước khi nộp. Có thể chọn kênh nộp phù hợp: Trực tiếp, Trực tuyến, Dịch vụ bưu chính. Hiện có khoảng 7 mục giấy tờ cần theo dõi trong checklist.",
    "tone": "supportive_public_service"
  },
  "guidance": {
    "highlight_documents": [
      {
        "bucket": "required",
        "name": "Văn bản đề nghị cấp Giấy phép của doanh nghiệp (theo Mẫu số 02 Phụ lục I ban hành kèm theo Nghị định số 372/2025/NĐ-CP);",
        "conditions": [],
        "attachment_path": "file:///C:/Users/ku060/Downloads/VAIC source/data-pipeline/raw_data/2_002027/M%E1%BA%ABu%20s%E1%BB%91%2002%20Ph%E1%BB%A5%20l%E1%BB%A5c%20I.docx"
      },
      {
        "bucket": "required",
        "name": "Bản sao Giấy chứng nhận đăng ký doanh nghiệp;",
        "conditions": [],
        "attachment_path": null
      },
      {
        "bucket": "required",
        "name": "01 bản sao sổ đăng ký thành viên mới nhất đối với công ty trách nhiệm hữu hạn, công ty hợp danh; 01 bản sao sổ đăng ký cổ đông mới nhất đối với công ty cổ phần;",
        "conditions": [],
        "attachment_path": null
      },
      {
        "bucket": "required",
        "name": "01 bản chính Giấy xác nhận nộp tiền ký quỹ hoạt động dịch vụ đưa người lao động Việt Nam đi làm việc ở nước ngoài theo hợp đồng (theo Mẫu số 03 Phụ lục I ban hành kèm theo Nghị định số 372/2025/NĐ-CP);",
        "conditions": [],
        "attachment_path": "file:///C:/Users/ku060/Downloads/VAIC source/data-pipeline/raw_data/2_002027/M%E1%BA%ABu%20s%E1%BB%91%2003%20Ph%E1%BB%A5%20l%E1%BB%A5c%20I.docx"
      },
      {
        "bucket": "required",
        "name": "01 bản sao văn bằng chuyên môn; 01 bản sao giấy tờ chứng minh kinh nghiệm làm việc (được thể hiện bằng một trong các giấy tờ sau: quyết định bổ nhiệm hoặc hợp đồng lao động, văn bản chấm dứt hợp đồng lao động; thông báo xác nhận thời gian tham gia bảo hiểm xã hội; giấy xác nhận kinh nghiệm của nơi đã làm việc) của người đại diện theo pháp luật.",
        "conditions": [],
        "attachment_path": null
      },
      {
        "bucket": "required",
        "name": "01 bản sao giấy chứng nhận quyền sở hữu nhà ở và tài sản khác gắn liền với đất hoặc hợp đồng thuê cơ sở vật chất để tổ chức giáo dục định hướng, kèm theo bảng kê do doanh nghiệp xác nhận về trang thiết bị, sơ đồ mặt bằng phòng học và khu vực nội trú.",
        "conditions": [],
        "attachment_path": null
      }
    ],
    "special_cases": [
      "Có yếu tố nước ngoài",
      "Có thể cần đối chiếu thông tin thửa đất hoặc giấy chứng nhận",
      "Có thể cần xác minh hồ sơ học tập hoặc văn bằng",
      "Có thể cần đối chiếu quá trình đóng bảo hiểm để giải quyết chế độ",
      "Có thể cần xác minh quan hệ lao động hoặc giấy phép làm việc"
    ],
    "common_errors": [
      "Thiếu giấy tờ hợp pháp hóa hoặc giấy tờ nhân thân của phía nước ngoài.",
      "Điền sai mẫu tờ khai hoặc chọn sai biểu mẫu đi kèm.",
      "Thông tin thửa đất, tài sản hoặc giấy chứng nhận chưa khớp với hồ sơ hiện có.",
      "Thiếu minh chứng học tập, văn bằng hoặc xác nhận từ cơ sở đào tạo.",
      "Thiếu hồ sơ về vị trí việc làm, đơn vị sử dụng lao động hoặc điều kiện làm việc áp dụng."
    ],
    "validation_hints": [
      "Nên xác định trước kênh nộp hồ sơ để biết có cần bản giấy, bản điện tử hay xuất trình trực tiếp.",
      "Có mẫu biểu đính kèm, nên kiểm tra đúng biểu mẫu trước khi nộp.",
      "Nên xác định đúng nhóm thủ tục lao động, đơn vị liên quan và hồ sơ nghề nghiệp cần xuất trình."
    ]
  },
  "intake": {
    "candidate_input_fields": [
      {
        "field_id": "employment_need",
        "label": "Nhu cầu việc làm hoặc lao động",
        "field_type": "text",
        "required": true
      },
      {
        "field_id": "worker_or_employer_info",
        "label": "Thông tin người lao động hoặc đơn vị sử dụng lao động",
        "field_type": "text",
        "required": true
      },
      {
        "field_id": "submission_channel_preference",
        "label": "Kênh nộp dự kiến",
        "field_type": "enum",
        "required": false
      },
      {
        "field_id": "has_supporting_employment_documents",
        "label": "Đã có hồ sơ lao động liên quan",
        "field_type": "boolean",
        "required": false
      }
    ],
    "suggested_clarifying_questions": [
      "Bạn đang cần giải quyết thủ tục lao động nào cho người lao động hoặc doanh nghiệp?",
      "Hồ sơ nghề nghiệp, đơn vị sử dụng lao động hoặc yếu tố lao động nước ngoài đã rõ chưa?"
    ]
  },
  "ui_hints": {
    "primary_channel": "online",
    "result_label": "Giấy phép hoạt động dịch vụ đưa người lao động Việt Nam đi làm việc ở nước ngoài theo hợp đồng",
    "time_badge": "15 ngày",
    "document_count_badge": 7
  },
  "provenance": {
    "generator": "workflow_domain_enricher",
    "derivation_mode": "rule_based_semantic_enrichment",
    "supported_group": true
  }
}