{
  "schema_version": "1.0",
  "enricher_version": "0.2.0",
  "source": {
    "procedure_code": "1.115313",
    "title": "Điều chỉnh quyết định giao đất, cho thuê đất, cho phép chuyển mục đích sử dụng đất do sai sót về ranh giới, vị trí, diện tích, mục đích sử dụng giữa bản đồ quy hoạch, bản đồ địa chính, quyết định giao đất, cho thuê đất, cho phép chuyển mục đích sử dụng đất và số liệu bàn giao đất trên thực địa",
    "group_key": "dien_luc_nha_o_dat_dai",
    "workflow_family": null,
    "subflow": null
  },
  "experience": {
    "entry_label": "Hỗ trợ nhà ở, đất đai và điện lực",
    "overview_summary": "Thủ tục này thuộc nhóm nhà ở, đất đai và điện lực, thường cần kiểm tra hiện trạng hồ sơ tài sản hoặc điều kiện hạ tầng liên quan. Kết quả thường nhận được là Giấy chứng nhận quyền sử dụng đất, quyền sở hữu tài sản gắn liền với đất. Thời gian xử lý tham khảo: 7 ngày làm việc.",
    "next_step_summary": "Nên chuẩn bị trước thông tin thửa đất, tài sản hoặc địa điểm tiếp nhận, rồi chọn kênh nộp phù hợp: Trực tiếp, Trực tuyến, Dịch vụ bưu chính. Hiện có khoảng 5 mục giấy tờ cần theo dõi trong checklist.",
    "tone": "supportive_public_service"
  },
  "guidance": {
    "highlight_documents": [
      {
        "bucket": "required",
        "name": "Đơn đề nghị điều chỉnh quyết định giao đất/cho thuê đất/cho phép chuyển mục đích sử dụng đất (theo Mẫu số 03)",
        "conditions": [],
        "attachment_path": "file:///C:/Users/ku060/Downloads/VAIC source/data-pipeline/raw_data/1_115313/Mau%20don%20so%2003.%20Don%20de%20nghi%20dieu%20chinh%20quyet%20dinh%20giao%20dat-cho%20thue%20dat-cho%20phep%20chuyen%20muc%20dich%20su%20dung%20dat.docx"
      },
      {
        "bucket": "required",
        "name": "Một trong các loại giấy tờ quy định tại Điều 137 Luật Đất đai",
        "conditions": [],
        "attachment_path": null
      },
      {
        "bucket": "required",
        "name": "Quyết định giao đất, cho thuê đất, cho phép chuyển mục đích sử dụng đất của cơ quan có thẩm quyền qua các thời kỳ",
        "conditions": [],
        "attachment_path": null
      },
      {
        "bucket": "required",
        "name": "Giấy chứng nhận quyền sử dụng đất, quyền sở hữu tài sản gắn liền với đất",
        "conditions": [],
        "attachment_path": null
      },
      {
        "bucket": "conditional",
        "name": "Văn bản về việc đại diện theo quy định của pháp luật về dân sự đối với trường hợp thực hiện thủ tục đăng ký đất đai, tài sản gắn liền với đất thông qua người đại diện",
        "conditions": [
          "Văn bản về việc đại diện theo quy định của pháp luật về dân sự đối với trường hợp thực hiện thủ tục đăng ký đất đai, tài sản gắn liền với đất thông qua người đại diện"
        ],
        "attachment_path": null
      }
    ],
    "special_cases": [
      "Có thể cần đối chiếu thông tin thửa đất hoặc giấy chứng nhận"
    ],
    "common_errors": [
      "Điền sai mẫu tờ khai hoặc chọn sai biểu mẫu đi kèm.",
      "Thông tin thửa đất, tài sản hoặc giấy chứng nhận chưa khớp với hồ sơ hiện có."
    ],
    "validation_hints": [
      "Nên xác định trước kênh nộp hồ sơ để biết có cần bản giấy, bản điện tử hay xuất trình trực tiếp.",
      "Có mẫu biểu đính kèm, nên kiểm tra đúng biểu mẫu trước khi nộp.",
      "Nên đối chiếu trước thông tin thửa đất, tài sản hoặc hiện trạng hồ sơ để tránh bị yêu cầu chỉnh sửa."
    ]
  },
  "intake": {
    "candidate_input_fields": [
      {
        "field_id": "property_or_service_need",
        "label": "Nhu cầu về đất đai, nhà ở hoặc điện lực",
        "field_type": "text",
        "required": true
      },
      {
        "field_id": "property_location",
        "label": "Địa điểm tài sản hoặc nơi sử dụng dịch vụ",
        "field_type": "text",
        "required": true
      },
      {
        "field_id": "submission_channel_preference",
        "label": "Kênh nộp dự kiến",
        "field_type": "enum",
        "required": false
      },
      {
        "field_id": "has_current_certificate",
        "label": "Đã có giấy tờ/tài liệu hiện trạng",
        "field_type": "boolean",
        "required": false
      }
    ],
    "suggested_clarifying_questions": [
      "Bạn đang xử lý nhu cầu nào về đất đai, nhà ở hoặc điện lực?",
      "Bạn đã có thông tin thửa đất, địa chỉ tài sản hoặc giấy tờ hiện trạng chưa?"
    ]
  },
  "ui_hints": {
    "primary_channel": "in_person",
    "result_label": "Giấy chứng nhận quyền sử dụng đất, quyền sở hữu tài sản gắn liền với đất",
    "time_badge": "7 ngày làm việc",
    "document_count_badge": 5
  },
  "provenance": {
    "generator": "workflow_domain_enricher",
    "derivation_mode": "rule_based_semantic_enrichment",
    "supported_group": true
  }
}